pathway	pval	padj	ES	NES	nMoreExtreme	size	leadingEdge
"Signaling by MET"	0.00836820083682008	0.0333497415702683	-0.458836606017966	-1.58948278295478	5	64	SH3GL3 LAMA4 LAMA2 ITGA2 LAMA1 LAMA3 LAMB3 LAMC2 ITGB1 STAM PTPRJ GAB1 SH3KBP1 RANBP9 SOS1 HGF USP8 PIK3CA CBL STAT3 SHC1 PTPN11 ITGA3 KRAS RAP1B MET MUC20 STAM2
"RHO GTPase Effectors"	0.0394736842105263	0.116732076194123	0.24495181080967	1.20674522630215	5	235	BIRC5 SPC24 CDC25C SPC25 CDC20 CENPA CENPM AURKB NOXA1 MAD1L1 MAD2L1 NUF2 NDC80 ARPC1B ZWINT DLG4 KIF2C KIF14 SKA1 CDCA8 PKN3 EVL CENPI BUB1 RANGAP1 ARPC4 MAPK11 IQGAP3 CENPK AR B9D2 LIN7B ERCC6L RHPN1 CENPF
"Degradation of beta-catenin by the destruction complex"	0.00371747211895911	0.0236681222707424	0.437286419126796	1.82875865459015	0	81	PSMB9 RPS27A PSMB8 SEM1 PSMB4 RBX1 PSME2 PSMB10 PSMA7 PSMC3 PSME1 PSMB6 PSMD4 TLE2 PSMA5 UBA52 PSMC5 PSMB1 PSMD13 PSMA2 PSMD9 PSMA3 PSMB5 PSMA4 PSMB3
"Transport of bile salts and organic acids, metal ions and amine compounds"	0.00143266475644699	0.0236681222707424	-0.562369785891647	-1.90512595399348	0	58	SLC6A12 SLC10A6 SLC11A1 RHCG SLC13A4 CP SLC6A14 SLC22A3 SLC47A2 SLC18A2 SLC6A13 SLC39A2 SLC22A15 SLC16A7 SLC39A6 SLC39A8 SLC44A5 SLC6A9 SLC41A2 SLC13A3 HEPH SLC14A1 SLC22A4 EMB SLC41A1 SLC44A4 SLC44A2 SLC6A6
"Transport of inorganic cations/anions and amino acids/oligopeptides"	0.00138888888888889	0.0236681222707424	-0.493320953335073	-1.7560569255691	0	79	SLC15A1 SLC6A12 SLC34A2 SLC26A9 SLC24A3 SLC16A10 SLC1A1 SLC9A2 SLC6A14 SLC7A11 SLC4A4 SLC24A4 SLC9A4 SLC12A2 SLC7A2 SLC4A8 SLC1A3 SLC12A6 SLC8A1 SLC5A5 SLC7A6 SLC7A5 SLC38A1 SLC17A5 SLC9A7 SLC9A3 SLC25A18 SLC26A7 SLC36A1 SLC9A1 SLC6A6 CALM1 AHCYL2 SLC7A1
"DNA strand elongation"	0.00274725274725275	0.0236681222707424	0.606218533593527	2.05673338889683	0	32	GINS1 POLA2 POLD4 GINS2 POLD1 RPA3 MCM5 MCM7 CDC45 RFC4 MCM2 DNA2 LIG1 FEN1 PCNA MCM3 PRIM2 RFC2
"Switching of origins to a post-replicative state"	0.00373134328358209	0.0236681222707424	0.54638208343448	2.32903588202271	0	88	PSMB9 ANAPC11 CCNA1 RPS27A PSMB8 SEM1 CDT1 PSMB4 RBX1 PSME2 PSMB10 PSMA7 PSMC3 PSME1 PSMB6 PSMD4 CCNA2 UBE2C ORC6 PSMA5 UBA52 PSMC5 PSMB1 MCM5 PSMD13 PSMA2 MCM7 ANAPC2 PSMD9 PSMA3 MCM2 PSMB5 PSMA4 ANAPC15 PSMB3 ANAPC16
"Respiratory electron transport, ATP synthesis by chemiosmotic coupling, and heat production by uncoupling proteins."	0.00462962962962963	0.0243486073674753	0.434937674168412	1.92474815753344	0	121	ATP5PO NDUFA9 NDUFB2 NDUFA11 COX8A NDUFA2 ETFB COX4I1 COX7C NDUFB6 ATP5MC3 CYC1 SURF1 UQCRC1 NDUFS5 ATP5ME UQCRQ SDHD COX7A2L ATP5PD NDUFA4 NDUFS6 NDUFS7 NDUFS3 ECSIT ATP5F1E NDUFAB1 COX14 NDUFB9 NDUFV1 NDUFA1 ATP5F1D COX6B1 UQCR11 NDUFA6 NDUFAF5 UQCR10 COX6C SDHC UCP2 NDUFAF4 ETFA NDUFB1 NDUFS8 NDUFS4 NDUFA8 SLC25A27 ATP5F1B NDUFAF1 NDUFAF3 CYCS ATP5MC1 TRAP1 COX11 NDUFA10 ATP5MG NDUFB8 UQCRH NDUFS2 TMEM126B COX20 ATP5F1A
"tRNA Aminoacylation"	0.00757575757575758	0.0306422433288105	0.541277565681956	1.70601346220116	2	24	VARS2 EEF1E1 FARSA AARS2 YARS2 TARS2 NARS2 PPA1 PPA2 MARS2 HARS2 EARS2
"Eukaryotic Translation Termination"	0.00374531835205993	0.0236681222707424	0.725353403670106	3.11575891316718	0	90	RPS21 RPS12 RPL39 RPS19 RPS18 RPL37A RPS27A RPL22L1 RPS28 RPL34 RPL31 RPS9 RPL37 RPL39L RPL10A RPL7A RPS16 RPS5 RPS29 RPS7 RPS15 RPL13 RPS3 RPS17 RPL18 RPL13A RPL9 RPS8 RPSA RPL3 RPL7 RPL10 RPL26 RPS2 FAU RPL19 RPS23 RPL26L1 RPS11 RPL6 RPL21 RPL29 RPL15 TRMT112 RPLP2 RPS13 RPL35A RPS20 RPL36 UBA52 RPL27 RPL18A RPL32 RPL22 RPL24 RPS14 RPLP0 RPL8 RPL38 RPL30 RPS27
"Eukaryotic Translation Elongation"	0.00367647058823529	0.0236681222707424	0.720688079173665	3.08693208005865	0	89	RPS21 RPS12 RPL39 RPS19 RPS18 RPL37A RPS27A RPL22L1 RPS28 RPL34 RPL31 RPS9 RPL37 RPL39L RPL10A RPL7A RPS16 RPS5 RPS29 RPS7 RPS15 RPL13 RPS3 RPS17 RPL18 RPL13A RPL9 RPS8 RPSA RPL3 RPL7 RPL10 RPL26 RPS2 FAU RPL19 RPS23 RPL26L1 RPS11 RPL6 RPL21 RPL29 RPL15 EEF1B2 RPLP2 RPS13 RPL35A RPS20 RPL36 UBA52 RPL27 RPL18A RPL32 RPL22 RPL24 RPS14 RPLP0 RPL8 EEF1A1 RPL38 RPL30 RPS27
"Mitochondrial translation"	0.00384615384615385	0.0236681222707424	0.550470802902185	2.37893786806105	0	94	CHCHD1 MRPS28 MRPL15 MRPS34 MRPL27 MRPS26 MRPL41 MRPS12 MRPL14 AURKAIP1 MRPL54 MRPL33 MRPL55 MRPS17 MRPS36 MRPL1 MRPL17 MRPS23 MRPL12 MRPL23 MRPL52 MRPL21 MRPS25 MRPS33 MRPL46 MRPL20 GADD45GIP1 MRPL43 MRPS18C MRPL2 MRPL22 MRPL34 MRPL47 MRPL57 MRPS18B MRPL11 TSFM MRPL18 MRPL28 MRPS7 DAP3 MRPS16 MRPS27 MRPS21 MRPL51 MRPL40 MRPS9 MRPL13 MRPL35 MRPL16 MRPL4 MRPL48 MRPS11 MRPL49 MRPL58 ERAL1 MRPS14 MRPL44 MRPL9
"SRP-dependent cotranslational protein targeting to membrane"	0.00418410041841004	0.0236681222707424	0.679655728571758	2.97240142853043	0	109	RPS21 RPS12 RPL39 RPS19 RPS18 RPL37A RPS27A RPL22L1 RPS28 RPL34 RPL31 RPS9 RPL37 RPL39L RPL10A RPL7A RPS16 RPS5 RPS29 RPS7 RPS15 RPL13 RPS3 SSR4 RPS17 RPL18 RPL13A RPL9 RPS8 RPSA RPL3 RPL7 RPL10 RPL26 RPS2 FAU RPL19 RPS23 RPL26L1 RPS11 RPL6 RPL21 RPL29 RPL15 RPLP2 RPS13 RPL35A RPS20 RPL36 UBA52 RPL27 RPL18A RPL32 RPL22 RPL24 RPS14 RPLP0 SEC61B SRPRB SRP19 RPL8 RPL38 RPL30 RPS27
"Eukaryotic Translation Initiation"	0.00431034482758621	0.0236681222707424	0.646449148164891	2.85219500692106	0	116	RPS21 RPS12 RPL39 RPS19 RPS18 RPL37A RPS27A RPL22L1 RPS28 RPL34 RPL31 RPS9 RPL37 RPL39L RPL10A RPL7A RPS16 RPS5 RPS29 RPS7 RPS15 RPL13 RPS3 RPS17 RPL18 RPL13A RPL9 RPS8 RPSA RPL3 RPL7 RPL10 RPL26 RPS2 FAU RPL19 RPS23 RPL26L1 RPS11 RPL6 RPL21 RPL29 RPL15 RPLP2 RPS13 RPL35A RPS20 RPL36 UBA52 RPL27 RPL18A RPL32 RPL22 RPL24 RPS14 EIF3K RPLP0 RPL8 RPL38 RPL30 RPS27
"Neurotransmitter release cycle"	0.0396341463414634	0.116732076194123	-0.489869508027734	-1.52814300757394	25	34	LIN7A SLC6A12 SLC1A1 SLC18A2 SLC6A13 SLC1A3 CASK STXBP1 VAMP2 APBA1
"tRNA processing in the mitochondrion"	0.00173010380622837	0.0236681222707424	-0.851808019887039	-2.25085424919738	0	17	MT-ND3 MT-ND4L MT-CO2 MT-ND1 MT-ND2 MT-ATP6 MT-ND5 MT-CO1 MT-CO3 MT-ND4 MT-CYB
"tRNA modification in the nucleus and cytosol"	0.024390243902439	0.0806067816775729	0.434458151045988	1.57314020814621	7	42	QTRT1 LAGE3 WDR4 CTU2 CTU1 TRMT112 TRMT1 URM1 TRMT12 ADAT2 PUS1 THG1L OSGEP TRMT61A TRMT44 TRMT11
