pathway	pval	padj	ES	NES	nMoreExtreme	size	leadingEdge
"Costimulation by the CD28 family"	0.00347222222222222	0.0236681222707424	0.599737353609838	2.37328025469062	0	63	HLA-DQA2 HLA-DRB5 PDCD1 CD3D CD247 HLA-DRB1 LCK CTLA4 CD3G GRAP2 HLA-DRA ICOS CD3E HLA-DPB1 HLA-DQB2 CD274 TRIB3 PRR5 TNFRSF14 HLA-DQB1 HLA-DPA1 HLA-DQA1
"MHC class II antigen presentation"	0.004	0.0236681222707424	0.376917135228911	1.6337783666918	0	100	HLA-DQA2 HLA-DRB5 LAG3 HLA-DRB1 HLA-DMB HLA-DRA HLA-DPB1 HLA-DQB2 KIF2C HLA-DMA CTSF HLA-DOA KIF15 KIF4A ACTR1B KIF23 DCTN3 KIF22 HLA-DOB KIF20A HLA-DQB1 KIF5C HLA-DPA1 HLA-DQA1 CD74 KLC4 RILP AP2S1 DNM1 AP1M1 KIF11
"TCR signaling"	0.00413223140495868	0.0236681222707424	0.534576572263006	2.35297255651731	0	110	HLA-DQA2 HLA-DRB5 CD3D CD247 ZAP70 HLA-DRB1 PSMB9 LCK CD3G RPS27A ITK GRAP2 PSMB8 HLA-DRA SEM1 CD3E CARD11 PRKCQ LAT HLA-DPB1 PSMB4 HLA-DQB2 PSME2 PSMB10 PSMA7 EVL PSMC3 PSME1 PSMB6 PSMD4 HLA-DQB1 HLA-DPA1 HLA-DQA1 PSMA5 UBA52 PSMC5 IKBKG PSMB1 PSMD13 PSMA2 PSMD9 PSMA3
"Signaling by the B Cell Receptor (BCR)"	0.00418410041841004	0.0236681222707424	0.422380699236203	1.84723668324208	0	109	IGHM IGKC PSMB9 RPS27A PSMB8 CD79A SEM1 CARD11 PSMB4 PSME2 PSMB10 PSMA7 PSMC3 PSME1 HRAS PSMB6 PSMD4 PSMA5 UBA52 BLK PSMC5 IKBKG PSMB1 PSMD13 PSMA2 NFKBIE PSMD9 PSMA3 TRPC1 PSMB5 PSMA4
"Immunoregulatory interactions between a Lymphoid and a non-Lymphoid cell"	0.00390625	0.0236681222707424	0.355114118994811	1.54443990310177	0	95	IGKC KLRB1 CD3D CD247 CD8B HLA-G CD8A KLRD1 CD3G NCR3 HLA-F SH2D1A CRTAM CD40 CD3E SLAMF6 CD1D KLRG1 CD160 CD96 ICAM5 IFITM1 HLA-B HLA-A HLA-E
"Class I MHC mediated antigen processing & presentation"	0.0476190476190476	0.131681243926142	0.223619600415365	1.14905133233612	4	349	PSMB9 SOCS1 ANAPC11 HLA-G ASB2 HLA-F RPS27A FBXW12 PSMB8 CDC20 SEM1 TAP1 PSMB4 FBXL15 TRAIP RBX1 FBXO6 PSME2 LRR1 PSMB10 PSMA7 BLMH RNF7 SPSB2 FBXW9 FBXO2 PSMC3 PSME1 FBXW4 GLMN PSMB6 FBXO27 FBXO41 PSMD4 FBXL8 CD207 HLA-B HLA-A TRIM69 UBE2C HLA-E UBE2L6 FBXO17 CCNF FBXL14 PSMA5 UBA52 HLA-C THOP1 UBA7 STUB1 PSMC5 IKBKG PSMB1 PSMD13 PSMA2 KEAP1 ANAPC2 PSMD9 RBCK1 PSMA3 FBXL16 SEC61B BTBD6 RNF114 PSMB5 VAMP8 PSMA4 B2M UBE2E3 MIB2 FBXL19 PSMB3 FBXW5 KLHL22 STX4
"Regulation of Apoptosis"	0.00327868852459016	0.0236681222707424	0.589023633771066	2.23763413315663	0	51	PSMB9 RPS27A PSMB8 SEM1 PSMB4 PSME2 PSMB10 PSMA7 PSMC3 PSME1 PSMB6 PSMD4 PSMA5 UBA52 PSMC5 PSMB1 PSMD13 PSMA2 PSMD9 PSMA3 PSMB5 PSMA4 PSMB3
"Signaling by ROBO receptors"	0.00584795321637427	0.0264441842310695	0.520940594607798	2.51078963355213	0	202	RPS21 RPS12 RPL39 RPS19 PSMB9 RPS18 RPL37A RPS27A RPL22L1 PSMB8 RPS28 SEM1 RPL34 RPL31 RPS9 RPL37 RPL39L RPL10A RPL7A RPS16 RPS5 RPS29 PSMB4 RPS7 RPS15 RPL13 RPS3 RPS17 RBX1 RPL18 RPL13A RPL9 ROBO3 RPS8 PSME2 RPSA RPL3 RPL7 RPL10 PSMB10 PSMA7 RPL26 RPS2 EVL FAU PSMC3 PSME1 RPL19 RPS23 RPL26L1 PSMB6 RPS11 RPL6 RPL21 PSMD4 RPL29 RPL15 RPLP2 RPS13 RPL35A RPS20 RPL36 PAK6 PSMA5 UBA52 RPL27 PSMC5 RPL18A PSMB1 PSMD13 RPL32 PSMA2 RPL22 PSMD9 RPL24 AKAP5 PSMA3 RPS14 RPLP0 RPL8 PSMB5 RPL38 RPL30 RPS27 PSMA4
"Resolution of Abasic Sites (AP sites)"	0.00294117647058824	0.0236681222707424	0.572919721199832	2.00602406148928	0	37	POLE4 NTHL1 POLD4 SMUG1 POLD1 MPG PNKP NEIL1 UNG RPA3 OGG1 MUTYH RFC4 LIG1 FEN1 PCNA RFC2 POLE
"Phase 0 - rapid depolarisation"	0.0363036303630363	0.11054251492565	-0.537531646839791	-1.53804917372579	21	24	CACNA1C CACNG6 SCN1B SCN3B FGF12 FGF13 CACNA1F CACNB1 CACNB4 SCN4B CALM1 CACNA1D FGF11 SCN9A
"G1/S DNA Damage Checkpoints"	0.00354609929078014	0.0236681222707424	0.545021013346204	2.16573074894111	0	65	PSMB9 CCNA1 RPS27A PSMB8 SEM1 PSMB4 PSME2 PSMB10 PSMA7 PSMC3 PSME1 PSMB6 PSMD4 CCNA2 PSMA5 UBA52 PSMC5 CHEK2 PSMB1 PSMD13 PSMA2 PSMD9 PSMA3 CHEK1 PSMB5 PCBP4 PSMA4 PSMB3 TP53
"Mitotic Spindle Checkpoint"	0.00418410041841004	0.0236681222707424	0.457381195207461	2.0024001538388	0	108	ANAPC11 BIRC5 SPC24 SPC25 CDC20 CENPA CENPM AURKB MAD1L1 MAD2L1 NUF2 NDC80 ZWINT KIF2C SKA1 CDCA8 CENPI BUB1 RANGAP1 CENPK B9D2 ERCC6L UBE2C CENPF ANAPC2 CENPH NUP85 NUP37 PLK1 CENPT DSN1 RPS27 ANAPC15 ANAPC16 DYNLL2 CENPU CENPE BUB1B
"G2/M Checkpoints"	0.00436681222707424	0.0236681222707424	0.517107903390346	2.35260638023994	0	129	PSMB9 RPS27A RMI2 CDK1 PKMYT1 CDC25C PSMB8 GTSE1 SEM1 CCNB1 PSMB4 BABAM1 CCNB2 PSME2 PSMB10 PSMA7 PSMC3 PSME1 PSMB6 PSMD4 SFN RPA3 ORC6 PSMA5 UBA52 PSMC5 CHEK2 PSMB1 MCM5 PSMD13 PSMA2 MCM7 CDC45 PSMD9 PSMA3 CHEK1 RFC4 MCM2 DNA2 PSMB5 BRIP1 PSMA4
"Regulation of mitotic cell cycle"	0.00374531835205993	0.0236681222707424	0.600491253607521	2.52637144500189	0	84	PSMB9 ANAPC11 CCNA1 RPS27A CDK1 PSMB8 CDC20 SEM1 AURKB CCNB1 NEK2 MAD2L1 PSMB4 PTTG1 PSME2 PSMB10 PSMA7 PSMC3 PSME1 PSMB6 PSMD4 CCNA2 UBE2C PSMA5 UBA52 AURKA PSMC5 PSMB1 PSMD13 PSMA2 ANAPC2 PSMD9 PSMA3 PLK1 PSMB5 PSMA4 ANAPC15 PSMB3 ANAPC16
"Mitotic G1-G1/S phases"	0.00469483568075117	0.0243486073674753	0.446289848589812	2.05688388301797	0	147	PSMB9 TK1 CCNA1 RPS27A CDK1 POLE4 PSMB8 SEM1 CCNB1 CDT1 CCND2 PSMB4 TYMS POLA2 PSME2 PSMB10 PSMA7 CDK4 PSMC3 PSME1 PSMB6 LIN37 PSMD4 CCNA2 TOP2A RRM2 RPA3 ORC6 PSMA5 UBA52 CKS1B PSMC5 PSMB1 MCM5 PSMD13 PSMA2 MCM7 CDC45 PSMD9 PSMA3 MYBL2 MCM2 PSMB5 PSMA4
"S Phase"	0.00531914893617021	0.0264441842310695	0.454453467969882	2.10136599124519	0	159	PSMB9 ANAPC11 CCNA1 RPS27A POLE4 PSMB8 SEM1 GINS1 CDT1 PSMB4 CDCA5 RBX1 POLA2 POLD4 PSME2 GINS2 PSMB10 PSMA7 CDK4 PSMC3 PSME1 POLD1 PSMB6 LIN37 PSMD4 CCNA2 ESCO2 UBE2C RPA3 ORC6 PSMA5 UBA52 CKS1B PSMC5 PSMB1 MCM5 PSMD13 PSMA2 MCM7 CDC45 ANAPC2 PSMD9 PSMA3 RFC4 MCM2 DNA2 LIG1 PSMB5 PSMA4 ANAPC15 PSMB3 ANAPC16 FEN1 PCNA
"Mitotic G2-G2/M phases"	0.00555555555555556	0.0264441842310695	0.412731190641184	1.94943436041647	0	180	PSMB9 CCNA1 RPS27A CDK1 PKMYT1 CDC25C PSMB8 GTSE1 SEM1 CCNB1 NEK2 SSNA1 PSMB4 RBX1 MZT2A CCNB2 PSME2 CEP131 PSMB10 PSMA7 CEP72 MZT2B PSMC3 PSME1 PSMB6 DCTN3 LIN37 PSMD4 CCNA2 CENPF AJUBA NINL HMMR PSMA5 UBA52 AURKA PLK4 PSMC5 PSMB1 PSMD13 PSMA2 FKBPL PSMD9 HAUS5 PSMA3 CEP250 MZT1 MYBL2 PLK1 HAUS4 PSMB5 SFI1 PSMA4 HAUS1 TUBGCP6 TPX2 PSMB3 TP53 OPTN
"M Phase"	0.00884955752212389	0.0347569578042837	0.365149744321562	1.85401976578427	0	312	PSMB9 ANAPC11 BIRC5 RPS27A CDK1 SPC24 SPC25 PSMB8 CDC20 CENPA SEM1 CENPM AURKB CCNB1 NEK2 SSNA1 MAD1L1 MAD2L1 NUF2 PSMB4 NDC80 CDCA5 ZWINT PTTG1 KIF2C MZT2A SKA1 CCNB2 PSME2 NCAPG CEP131 PSMB10 PSMA7 CEP72 NCAPH KIF23 CDCA8 CENPI BANF1 BUB1 RANGAP1 MZT2B PSMC3 PSME1 CENPK B9D2 PSMB6 DCTN3 PSMD4 ERCC6L KIF20A UBE2C CENPF NCAPH2 NINL PSMA5 UBA52 PLK4 PSMC5 LMNA PSMB1 PSMD13 PSMA2 ANAPC2 PSMD9 CENPH NUP85 HAUS5 PSMA3 CEP250 MZT1 NUP37 NUP210 PLK1 CENPT HAUS4 PSMB5 DSN1 SFI1 RPS27 PSMA4 HAUS1 TUBGCP6 ANAPC15 PSMB3 ANAPC16 DYNLL2
"Cell-cell junction organization"	0.0400593471810089	0.116732076194123	-0.462306132670647	-1.49473136939072	26	42	CDH11 CDH5 SDK2 CLDN10 AFDN CLDN16 CDH8 CDH1 CLDN8 CLDN9 PARD3 JUP PRKCI CDH13 CLDN1 PARD6B CTNND1 NECTIN1
"Cellular response to hypoxia"	0.00350877192982456	0.0236681222707424	0.458079902368137	1.86140464948177	0	71	PSMB9 RPS27A PSMB8 SEM1 PSMB4 RBX1 PSME2 PSMB10 PSMA7 EGLN2 PSMC3 PSME1 PSMB6 PSMD4 AJUBA PSMA5 UBA52 PSMC5 PSMB1 PSMD13 PSMA2 PSMD9 PSMA3 PSMB5 PSMA4 EPAS1 PSMB3
"Nucleosome assembly"	0.00256410256410256	0.0236681222707424	0.58446093286835	1.89868312322029	0	26	CENPW CENPA CENPM OIP5 CENPI HJURP CENPK CENPH CENPT MIS18A CENPU
"Telomere Maintenance"	0.00591715976331361	0.0264441842310695	0.525549222757957	1.80751733851252	1	35	POLE4 POLA2 POLD4 POLD1 RPA3 ACD RFC4 DNA2 LIG1 RUVBL2 FEN1 PCNA WRAP53 PRIM2 RFC2 POLE
"Assembly of collagen fibrils and other multimeric structures"	0.00145560407569141	0.0236681222707424	-0.638968332978071	-2.13529479826474	0	50	MMP9 COL1A2 MMP7 COL6A3 CTSV COL3A1 COL4A1 COL6A2 COL4A2 MMP13 COL6A6 COL1A1 LAMA3 DST PXDN COL5A2 LAMB3 LAMC2
"Collagen biosynthesis and modifying enzymes"	0.00143472022955524	0.0236681222707424	-0.56884029370812	-1.91408687914791	0	51	COL1A2 COL14A1 COL12A1 COL6A3 COL3A1 COL4A1 COL6A2 COL4A2 COL17A1 COL6A6 COL1A1 COL5A2 COL28A1 TLL1 COL8A2 COL5A1 COLGALT2
"TNFR2 non-canonical NF-kB pathway"	0.00373134328358209	0.0236681222707424	0.490290408286092	2.08993667276209	0	88	TNFRSF18 PSMB9 RPS27A PSMB8 CD27 SEM1 CD40 TNFRSF13C PSMB4 TNFRSF25 PSME2 PSMB10 PSMA7 TNFRSF14 PSMC3 PSME1 TRAF2 PSMB6 PSMD4 EDARADD PSMA5 UBA52 PSMC5 PSMB1 PSMD13 PSMA2 PSMD9 PSMA3 LTB PSMB5 TNFRSF9 PSMA4 MAP3K14
"Interferon Signaling"	0.00568181818181818	0.0264441842310695	0.428127981118893	2.00627750395522	0	175	HLA-DQA2 HLA-DRB5 IFI27 ISG15 HLA-DRB1 SOCS1 IFI6 HLA-G IFIT2 BST2 GBP4 IFI35 HLA-F RPS27A IFIT3 PSMB8 GBP1 HLA-DRA CIITA OASL HLA-DPB1 RSAD2 HLA-DQB2 TRIM31 MT2A IFIT1 IFITM1 USP18 TRIM45 STAT1 IRF1 HLA-B HLA-A HLA-E UBE2L6 IRF8 HLA-DQB1 HLA-DPA1 IRF3 XAF1 HLA-DQA1 MX1 UBA52 HLA-C UBA7
"Signaling by Interleukins"	0.0032967032967033	0.0236681222707424	-0.329095149498106	-1.42924880796159	2	386	FN1 MMP9 COL1A2 IL1R2 IL36G S100A12 MMP2 CSF2RB CXCL8 FPR1 PTGS2 CSF3R S1PR1 ITGAM IL1B IL1A CXCL2 SERPINB2 ALOX5 ITGAX JUNB DUSP4 CCR1 IL22RA1 GATA3 IL1RN IL1R1 GAB2 OSM LCP1 CRLF1 GSTA2 IL18RAP IL11 CCL22 NOD2 FOXO1 ZEB1 LCN2 HIF1A DUSP6 ITGB1 PELI1 ICAM1 HMOX1 CSF3 TSLP MEF2C F13A1 BCL2L1 VIM TNFRSF1B IL1RAP NFKBIA FOS TRAF6 TAB2 CXCL1 HCK PRKACA PTPN12 IL6R MAPK10 IL1RL2 CD86 RORA OSMR VAMP2 RPS6KA5 SOS1 TIMP1 SOS2 MEF2A HGF BLNK SOCS2 SOX2 RHOU CDKN1A TAB3 MAP3K8 IRAK3 TEC PIK3CA IL17RA IRS2 VEGFA JAK1 IL13RA1 YWHAZ BCL6 LYN DUSP3
"mRNA decay by 3' to 5' exoribonuclease"	0.0490654205607477	0.134310393656188	0.53934078672007	1.54933960588738	20	16	EXOSC5 EXOSC4 EXOSC7 EXOSC1 WDR61 EXOSC6 EXOSC8 EXOSC3 EXOSC2 SKIV2L
"Activation of Matrix Metalloproteinases"	0.00168067226890756	0.0236681222707424	-0.782060451648554	-2.16016942332347	0	21	MMP9 MMP7 MMP2 CTSV MMP25 MMP13 PLG TIMP2
"Collagen degradation"	0.00158478605388273	0.0236681222707424	-0.719230345715718	-2.15313197728277	0	29	MMP9 MMP7 MMP2 COL14A1 COL12A1 MMP13 MMP19 COL17A1
"Diseases associated with O-glycosylation of proteins"	0.0178041543026706	0.0618580232823556	-0.490063856713832	-1.58447783377474	11	42	ADAMTS1 THBS1 ADAMTS9 MUCL1 MUC21 MUC15 THSD4 CFP MUC13 ADAMTSL4 ADAMTS15 SPON1 THBS2 MUC5AC ADAMTSL3
"Diseases associated with the TLR signaling cascade"	0.0247524752475248	0.080818322796135	-0.548020740718793	-1.56806181069066	14	24	TLR4 TLR6 TLR1 NFKBIA TLR2 LY96 TICAM1 BTK CD14 MYD88 CD36 RELA TLR10 TLR5
"Hh mutants abrogate ligand secretion"	0.00325732899022801	0.0236681222707424	0.593393766191849	2.28449501653334	0	53	PSMB9 RPS27A PSMB8 SEM1 PSMB4 PSME2 PSMB10 PSMA7 PSMC3 PSME1 PSMB6 PSMD4 PSMA5 UBA52 PSMC5 PSMB1 PSMD13 PSMA2 PSMD9 PSMA3 PSMB5 PSMA4 PSMB3
"Oncogenic MAPK signaling"	0.00420757363253857	0.0236681222707424	-0.470242185371619	-1.65111207442929	2	70	FN1 SPRED3 APBB1IP ARRB2 AKAP9 RASAL2 BCL2L11 IQGAP1 TRIM24 KIAA1549 SPRED2 BRAF AP3B1 QKI RASAL1 BRAP ZC3HAV1 TRAK1 MAPK3 RASA2 VWF KSR1 ESRP1 KRAS RAP1B CALM1 MAPK1 ARRB1 MPRIP SYNGAP1
"ABC transporter disorders"	0.0033112582781457	0.0236681222707424	0.587787400323474	2.32841635572525	0	60	PSMB9 RPS27A PSMB8 SEM1 DERL3 PSMB4 KCNJ11 PSME2 PSMB10 PSMA7 PSMC3 PSME1 PSMB6 PSMD4 PSMA5 UBA52 PSMC5 PSMB1 PSMD13 PSMA2 PSMD9 PSMA3 PSMB5 PSMA4 PSMB3
"Recognition of DNA damage by PCNA-containing replication complex"	0.0136986301369863	0.0504177519196293	0.506900414348139	1.70272965882602	4	31	RPS27A POLE4 RBX1 POLD4 ZBTB32 POLD1 RPA3 UBA52 RFC4 PCNA RFC2 POLE DTL
"Translesion synthesis by Y family DNA polymerases bypasses lesions on DNA template"	0.00903614457831325	0.0349827882960413	0.525515250003747	1.85073133109095	2	38	ISG15 RPS27A POLE4 PCLAF POLD4 POLD1 UBE2L6 RPA3 UBA52 UBA7 MAD2L2 RFC4
"Homology Directed Repair"	0.0040650406504065	0.0236681222707424	0.427145193541804	1.84393666821844	0	99	CCNA1 RPS27A RMI2 POLE4 BABAM1 XRCC3 POLD4 POLD1 CCNA2 RAD51D RAD51 RPA3 UBA52 EME1 RAD51AP1 EME2 RAD52 CHEK1 RFC4 DNA2 BRIP1 MUS81 FEN1 PCNA TIMELESS PPP4C RAD9A SIRT6 RTEL1 RAD51C RFC2 POLE UBE2I ERCC1 BARD1 BLM
"Assembly of the pre-replicative complex"	0.00352112676056338	0.0236681222707424	0.579120784549107	2.31134103342583	0	66	PSMB9 RPS27A PSMB8 SEM1 CDT1 PSMB4 PSME2 PSMB10 PSMA7 PSMC3 PSME1 PSMB6 PSMD4 ORC6 PSMA5 UBA52 PSMC5 PSMB1 MCM5 PSMD13 PSMA2 MCM7 PSMD9 PSMA3 MCM2 PSMB5 PSMA4 PSMB3
"Molecules associated with elastic fibres"	0.0214521452145215	0.0726691419141914	-0.563846498928228	-1.61334434332052	12	24	TGFB2 BMP2 MFAP4 ITGB6 ITGB1 FBLN2 ITGB8 ITGAV FBLN1 EFEMP1 TGFB3
"Influenza Infection"	0.00476190476190476	0.0243486073674753	0.574338272258131	2.64348708638067	0	149	RPS21 RPS12 RPL39 ISG15 RPS19 RPS18 RPL37A RPS27A RPL22L1 RPS28 RPL34 RPL31 RPS9 RPL37 RPL39L RPL10A RPL7A RPS16 RPS5 RPS29 RPS7 RPS15 RPL13 RPS3 RPS17 RPL18 RPL13A RPL9 RPS8 RPSA RPL3 RPL7 RPL10 RPL26 RPS2 FAU RPL19 RPS23 RPL26L1 RPS11 RPL6 RPL21 RPL29 RPL15 POLR2H RPLP2 RPS13 RPL35A RPS20 RPL36 UBA52 RPL27 RPL18A RPL32 RPL22 NUP85 RPL24 RPS14 RPLP0 NUP37 NUP210 RPL8 RPL38 RPL30 RPS27 POLR2G PABPN1 RPS4X POLR2E RPL35 RPLP1 RPS25 RAN RPL12 HSPA1A RPL23 RPS24 NUP93 RPL28
"HIV Infection"	0.00613496932515337	0.0268157530180091	0.30220591381789	1.48706751533886	0	224	CD247 PSMB9 CD8B LCK VPS37D RPS27A PSMB8 SEM1 CCR5 MVB12A VPS28 PSMB4 RBX1 PSME2 PSMB10 PSMA7 CHMP6 BANF1 RANGAP1 PSMC3 PSME1 PSMB6 NELFB PSMD4 HLA-A POLR2H PSMA5 UBA52 PSMC5 PSMB1 PSMD13 TAF13 PSMA2 GTF2H4 PSMD9 NUP85 PSMA3 CD28 NUP37 AP2S1 NUP210 LIG1 PSMB5 PSMA4 POLR2G B2M AP1M1 POLR2E PSMB3 FEN1 ERCC2 SLC25A4 TAF11 ATP6V1H TAF6 RAN VPS4A PSMD14 APOBEC3G NUP93 SLC25A5 MVB12B AP2M1 AP1M2
"ROS, RNS production in phagocytes"	0.0156985871271586	0.0567242281527996	-0.530418353781806	-1.62277008749277	9	31	ATP6V0C NOS3 SLC11A1 NCF1 NCF2 ATP6V0D2 NCF4 ATP6V1C2 ATP6V0A4 ATP6V0A1
"Antimicrobial peptides"	0.00313479623824451	0.0236681222707424	-0.620843423750331	-1.9068495122585	1	32	RNASE7 S100A7 PRSS3 PGLYRP3 SLC11A1 PI3 BPIFB2 EPPIN BPIFB1 LCN2 CLU DEFB1 DEFB4A TLR1 TLR2 S100A8
"Toll-like Receptor Cascades"	0.0137672090112641	0.0504177519196293	-0.378036257373592	-1.48269218559225	10	143	S100A12 TLR8 CTSV ITGAM TLR4 TLR6 DUSP4 NOD2 DUSP6 PELI1 TLR1 MEF2C NFKBIA FOS TRAF6 TAB2 TLR2 MAPK10 S100A8 LY96 RPS6KA5 TICAM1 MEF2A TAB3 MAP3K8 IRAK3 PLCG2 DUSP3 CTSL ITGB2 EEA1 ATF1 MAPK3 BTK UBE2V1 UBE2D3 PTPN11 TANK HSP90B1 MAP3K1 IRAK2 TBK1 MAP2K7 CD14 MYD88 PIK3R4 DUSP7 MAPK1 CD36 RIPK1 CASP8 CTSS ELK1 CD180 RELA CREB1 DNM3 TLR10 BTRC PELI2 BIRC2 TLR5
"Fc epsilon receptor (FCERI) signaling"	0.0131578947368421	0.0495248538011696	0.313924533478185	1.42473251421423	2	128	IGKC PSMB9 RPS27A ITK GRAP2 PSMB8 SEM1 CARD11 PRKCQ LAT PSMB4 PSME2 PSMB10 PSMA7 PSMC3 PSME1 HRAS PSMB6 PSMD4 VAV2 PSMA5 UBA52 PSMC5 IKBKG PSMB1 PSMD13 PSMA2 TAB1 PSMD9 PSMA3
"Neutrophil degranulation"	0.00108932461873638	0.0236681222707424	-0.448883743629546	-1.96001680464584	0	422	S100A7 MMP9 MME ARG1 MNDA ADGRE3 S100A12 AOC1 FPR2 CXCR2 HRNR SIRPB1 SLC2A3 FCGR2A CR1 SERPINA1 FPR1 PRSS3 ADGRG3 FCGR3B CXCR1 ATP6V0C TXNDC5 SLC11A1 CHI3L1 PTPRB ITGAM CLEC5A FTH1 C5AR1 CEACAM6 MMP25 PECAM1 CEACAM3 P2RX1 ALOX5 QPCT SELL ITGAX DOK3 LILRB3 CD93 PTPRC SIGLEC9 CEACAM1 LILRB2 CD55 GLIPR1 PLAUR FGL2 FGR TIMP2 OLR1 NFAM1 RAB44 CLEC12A CSNK2B LCN2 VNN1 BIN2 CD44 SIRPA IGF2R HSPA6 CFP CD53 TCN1 FCER1G TNFRSF1B PLAU IQGAP1 GM2A CXCL1 TLR2 PTPRJ CTSA TMBIM1 CD58 RAB31 DDX3X S100A8 SIGLEC14 ARL8A GPR84 ITGAV ATP6V0A1 ADAM8 DSP ERP44 RAB5C CMTM6 CRISPLD2 SERPINB3 CDK13 LTA4H ANO6 LRG1 MGAM ITGB2 ATP11B IQGAP2 NCSTN RAB6A JUP CD59 CPPED1 DOCK2 RHOA SLPI HEXB LAMP1 AMPD3 ASAH1 PSEN1 ARSB CAP1 PADI2 METTL7A RAB5B CD300A HSPA8 GLA HSP90AA1 ROCK1 CTSD CD14 ATP11A PNP ENPP4 SDCBP STOM STK10 RAB7A SLC44A2 SNAP29 SERPINB10 RAP1B CSTB C3AR1 KPNB1 CAB39 KCMF1 FAF2 CRACR2A MAPK1 CD36 LAMP2 CREG1 RAP2B CAT C3 XRCC5 LYZ ADAM10
"Integrin alphaIIb beta3 signaling"	0.0235690235690236	0.0788543874963628	-0.578045449909303	-1.61929659385651	13	22	FN1 RAPGEF4 APBB1IP SOS1 SHC1 VWF RASGRP1 RAP1B
"Formation of the cornified envelope"	0.00147492625368732	0.0236681222707424	-0.845926661021711	-2.72796846687102	0	40	KLK14 RPTN SPRR2E SPRR2D KLK13 SPRR1B FLG KLK12 SPRR2A IVL SPRR1A SPINK5 SPRR2F TGM5 SPRR3 DSC2 PI3 TGM1 DSG3
"MAPK6/MAPK4 signaling"	0.0291970802919708	0.0918410573582987	0.338939884561237	1.42976490925891	7	83	PSMB9 RPS27A CDK1 PSMB8 SEM1 PSMB4 PSME2 PSMB10 PSMA7 PSMC3 PSME1 PSMB6 PSMD4 PSMA5 UBA52 PSMC5 PSMB1 PSMD13 PSMA2 PSMD9 PSMA3 PSMB5 PSMA4
"Sulfur amino acid metabolism"	0.0294840294840295	0.0918410573582987	0.520665008898764	1.60266426060215	11	21	SLC25A10 TST MPST TSTD1 SUOX MAT1A ETHE1
"Metabolism of polyamines"	0.00714285714285714	0.0296466469751668	0.408331540699808	1.70328169249698	1	78	PSMB9 GAMT PSMB8 SEM1 PSMB4 PSME2 PSMB10 PSMA7 PSMC3 PSME1 NAGS PSMB6 PSMD4 OAZ1 CKMT1A PSMA5 SLC6A8 PSMC5 PSMB1 PSMD13 PSMA2 PAOX PSMD9 PSMA3 ASL PSMB5 PSMA4 ASS1 NMRAL1 PSMB3 CKB
"Selenoamino acid metabolism"	0.00396825396825397	0.0236681222707424	0.695281938417841	3.04696194264606	0	102	RPS21 RPS12 RPL39 RPS19 RPS18 RPL37A RPS27A RPL22L1 RPS28 RPL34 RPL31 RPS9 RPL37 RPL39L RPL10A RPL7A RPS16 RPS5 RPS29 RPS7 RPS15 RPL13 RPS3 RPS17 RPL18 RPL13A RPL9 RPS8 RPSA RPL3 RPL7 RPL10 RPL26 RPS2 FAU RPL19 RPS23 RPL26L1 RPS11 RPL6 RPL21 RPL29 RPL15 RPLP2 RPS13 RPL35A RPS20 RPL36 UBA52 RPL27 RPL18A RPL32 EEF1E1 RPL22 RPL24 RPS14 RPLP0 PAPSS2 RPL8 RPL38 RPL30 RPS27 MAT1A RPS4X RPL35 RPLP1 RPS25 RPL12 RPL23 RPS24 RPL28 SEPSECS EEFSEC RPL27A RPL17 SEPHS2 RPS3A RPL5 RPS6
"Biosynthesis of specialized proresolving mediators (SPMs)"	0.00683760683760684	0.0294125627458961	-0.689501694962931	-1.79136580100559	3	15	PTGS2 ALOX5 ALOX5AP CYP2E1 CYP3A4 ALOX12 HPGD CYP2C8 LTA4H
"Phospholipid metabolism"	0.0108173076923077	0.0412885969664139	-0.353274231343549	-1.44000134651926	8	189	PLA2G4D PLA2G2F DGAT2 PLA2G4E PIK3CG PHOSPHO1 GPAT3 PIK3C2G PLBD1 CSNK2B LPCAT2 PLB1 MGLL MBOAT7 PIK3R5 PNPLA3 RAB5A PIP5K1A SLC44A5 CDS1 GPCPD1 PLA2R1 OSBPL8 INPP4B PTEN PIK3CA MTMR7 SBF2 PLEKHA3 SYNJ2 CSNK2A1 CDS2 PIK3C2A PIP5K1B LCLAT1 MBOAT2 PIP4K2A LPCAT3 AGPAT1 MTM1 SLC44A4 CSNK2A2 PIK3R4 PLA2G4F SLC44A2 PCYT1B PNPLA2 MTMR12 MTMR6 PLEKHA5 PLD1 SYNJ1 PTPN13 CPNE3
"eNOS activation and regulation"	0.0376068376068376	0.1132383665717	-0.623685255107143	-1.62037083411441	21	15	NOS3 CAV1 CYGB NOSTRIN DDAH1 ZDHHC21 LYPLA1 WASL HSP90AA1 CALM1
"Nucleotide salvage"	0.0417690417690418	0.120419258717131	0.493639947623091	1.51947814456429	16	21	TK1 TYMP APRT ADA AMPD1 UCK1 DGUOK TK2 HPRT1 ADK UCKL1 ADAL PUDP DCK
"Interconversion of nucleotide di- and triphosphates"	0.0289473684210526	0.0918410573582987	0.477579020236086	1.5892844353589	10	28	NME3 DTYMK GUK1 TYMS DCTPP1 DUT AK4 RRM2 CTPS1
"Cristae formation"	0.0289473684210526	0.0918410573582987	0.469185039984212	1.56135100110038	10	28	ATP5PO ATP5MC3 MTX2 ATP5ME ATP5PD ATP5F1E ATP5F1D SAMM50 ATP5F1B ATP5MC1 ATP5MG ATP5F1A CHCHD6 ATP5MC2 ATP5PF ATP5PB
"Syndecan interactions"	0.020442930153322	0.0701270135639273	-0.619335968123655	-1.66495821943096	11	18	THBS1 ITGA2 ITGB1 ACTN1 CASK PRKCA TNC ITGAV
"Nonsense Mediated Decay (NMD) independent of the Exon Junction Complex (EJC)"	0.00377358490566038	0.0236681222707424	0.710198682623092	3.05109347945721	0	92	RPS21 RPS12 RPL39 RPS19 RPS18 RPL37A RPS27A RPL22L1 RPS28 RPL34 RPL31 RPS9 RPL37 RPL39L RPL10A RPL7A RPS16 RPS5 RPS29 RPS7 RPS15 RPL13 RPS3 RPS17 RPL18 RPL13A RPL9 RPS8 RPSA RPL3 RPL7 RPL10 RPL26 RPS2 FAU RPL19 RPS23 RPL26L1 RPS11 RPL6 RPL21 RPL29 RPL15 RPLP2 RPS13 RPL35A RPS20 RPL36 UBA52 RPL27 RPL18A RPL32 RPL22 RPL24 RPS14 RPLP0 RPL8 RPL38 RPL30 RPS27
"Nonsense Mediated Decay (NMD) enhanced by the Exon Junction Complex (EJC)"	0.00420168067226891	0.0236681222707424	0.651781518488148	2.8699401409099	0	112	RPS21 RPS12 RPL39 RPS19 RPS18 RPL37A RPS27A RPL22L1 RPS28 RPL34 RPL31 RPS9 RPL37 RPL39L RPL10A RPL7A RPS16 RPS5 RPS29 RPS7 RPS15 RPL13 RPS3 RPS17 RPL18 RPL13A RPL9 RPS8 RPSA RPL3 RPL7 RPL10 RPL26 RPS2 FAU RPL19 RPS23 RPL26L1 RPS11 RPL6 RPL21 RPL29 RPL15 RPLP2 RPS13 RPL35A RPS20 RPL36 UBA52 RPL27 RPL18A RPL32 RPL22 RPL24 RPS14 RPLP0 RPL8 RPL38 RPL30 RPS27
"Transcription-Coupled Nucleotide Excision Repair (TC-NER)"	0.0177935943060498	0.0618580232823556	0.349029138565619	1.4550781758832	4	77	RPS27A POLE4 RBX1 POLD4 POLD1 POLR2H RPA3 UBA52 COPS5 GTF2H4 PPIE RFC4 ISY1 LIG1 COPS7A POLR2G XAB2 POLR2E PCNA ERCC2 PRPF19 RFC2 COPS4 POLE GPS1 ERCC1 ERCC3 GTF2H3 ERCC8 ZNF830 POLD2 POLR2C RPA1 COPS7B HMGN1
"Platelet Aggregation (Plug Formation)"	0.0163398692810458	0.0582645338837289	-0.569684787771936	-1.65919699966081	9	26	FN1 ADRA2A RAPGEF4 APBB1IP SOS1 MPL SHC1 VWF RASGRP1 RAP1B
"Response to elevated platelet cytosolic Ca2+"	0.00133155792276964	0.0236681222707424	-0.505758486122864	-1.8837809790846	0	103	FN1 F5 ECM1 SPARC SERPINA1 TGFB2 SELP SRGN THBS1 PECAM1 PROS1 PLG PLEK CD109 LHFPL2 TIMP3 CLU CALU F13A1 FLNA A2M PHACTR2 ACTN1 RAB27B PRKCA PRKCB FAM3C SERPINE1 TIMP1 HGF
"Post-translational modification: synthesis of GPI-anchored proteins"	0.00277777777777778	0.0236681222707424	-0.484923182531058	-1.68410401792963	1	65	LY6G6C CEACAM7 FCGR3B LYPD5 VNN2 NTNG2 CEACAM5 LY6K CD109 PLAUR GPLD1 VNN1 CPM PIGA
"Post-translational protein phosphorylation"	0.0461538461538462	0.130288461538462	-0.396061253121336	-1.40004199154269	32	74	FN1 F5 SERPINA1 SPP1 BPIFB2 CP VCAN AMTN CALU SCG2 MATN3 MIA3 IGFBP5 TIMP1 TNC FBN1 IGFBP7 MFGE8 TF FSTL1 HSP90B1 PNPLA2 TGOLN2 FSTL3 C3 ADAM10 APLP2 GOLM1 KTN1 MSLN DNAJC3 RCN1 SDC2 P4HB LAMC1 VWA1
"O-linked glycosylation"	0.00136054421768707	0.0236681222707424	-0.467130902314292	-1.70165396152003	0	90	ADAMTS1 THBS1 B3GNT6 ADAMTS9 MUCL1 MUC21 MUC15 GALNT6 THSD4 CFP MUC13 ADAMTSL4 GCNT3 POMK GALNTL6 GALNT1 GALNT5 ST6GALNAC3 ADAMTS15 B3GNT7 SPON1 THBS2 MUC5AC B3GNT5 GALNT13 ST3GAL1 ADAMTSL3 ST3GAL4 ST6GALNAC2 GCNT4
Neddylation	0.00595238095238095	0.0264441842310695	0.348786806864974	1.70725667255409	0	221	PSMB9 BIRC5 ASB2 RPS27A COMMD4 FBXW12 PSMB8 SEM1 COMMD6 PSMB4 FBXL15 RBX1 CCDC22 FBXO6 PSME2 LRR1 PSMB10 PSMA7 RNF7 SPSB2 FBXW9 COMMD8 FBXO2 PSMC3 PSME1 FBXW4 PSMB6 NEDD8 FBXO27 FBXO41 PSMD4 FBXL8 FBXO17 COMMD10 OBSL1 CCNF FBXL14 PSMA5 UBA52 COMMD5 PSMC5 NEURL2 COPS5 PSMB1 PSMD13 PSMA2 KEAP1 PSMD9 PSMA3 FBXL16 BTBD6 PSMB5 COPS7A PSMA4 EPAS1 FBXL19 PSMB3 FBXW5 KLHL22 CUL9 SPSB3 COMMD1 KLHL25 WDR5 FBXO44 KCTD6 ASB1
"Neurexins and neuroligins"	0.0471976401179941	0.131681243926142	-0.455279526429257	-1.46819842539412	31	40	LIN7A NLGN4X SHANK2 EPB41L3 NRXN3 SYT7 CASK STXBP1 APBA1 PDLIM5 SIPA1L1 EPB41L5 EPB41 HOMER1
"AUF1 (hnRNP D0) binds and destabilizes mRNA"	0.00325732899022801	0.0236681222707424	0.575925100092365	2.21724274169759	0	53	PSMB9 RPS27A PSMB8 SEM1 PSMB4 PSME2 PSMB10 PSMA7 PSMC3 PSME1 PSMB6 PSMD4 PSMA5 UBA52 PSMC5 PSMB1 PSMD13 PSMA2 PSMD9 PSMA3 PSMB5 PSMA4 PSMB3
"rRNA processing in the mitochondrion"	0.00168067226890756	0.0236681222707424	-0.767111041093124	-2.11887688703619	0	21	MT-ND3 MT-ND4L MT-CO2 MT-ND1 MT-ND2 MT-ATP6 MT-ND5 MT-CO1 MT-CO3 MT-ND4 MT-CYB
"rRNA processing in the nucleus and cytosol"	0.00564971751412429	0.0264441842310695	0.607422742680565	2.86899032862021	0	186	RPS21 RPS12 RPL39 RPS19 RPS18 RPL37A RPS27A RPL22L1 RPS28 RPL34 RPL31 RPS9 RPL37 RPL39L NOL12 RPL10A RPL7A RPS16 EXOSC5 RPS5 RPS29 RPS7 RPS15 EMG1 RRP9 RPL13 RPS3 RRP7A RPS17 RPL18 RPL13A RPL9 EXOSC4 WDR18 RPS8 RPSA RPL3 RPL7 RPL10 RPL26 RPS2 DDX49 FAU EXOSC7 RPL19 RPS23 GAR1 RPL26L1 RPS11 RPL6 RPL21 RPL29 RPL15 BYSL TBL3 TRMT112 RPLP2 RPS13 EXOSC1 RPL35A RPS20 RPL36 RRP1 BOP1 UBA52 FBL RPL27 RPL18A RPL32 SNU13 RPL22 RPL24 RPS14 RPLP0 WDR46 RPL8 EXOSC6 RPL38 RPL30 RPS27 IMP3 UTP18 RPS4X TSR3 RPL35 NOC4L EXOSC8 PES1 RPLP1 RPS25 RPL12 RPL23 SENP3 RPS24 EXOSC3 EXOSC2 RPL28 PNO1 PELP1
"GPCR ligand binding"	0.00361881785283474	0.0236681222707424	-0.375431987524651	-1.54267779994609	2	205	CXCL5 HRH2 ADGRE3 FPR2 CXCR2 PROK2 CXCL8 FPR1 PTGER3 ADGRE2 XCR1 CXCR1 OXTR S1PR1 GPR65 C5AR1 FFAR2 ADRA2A FZD7 CXCL2 P2RY13 HCAR3 HTR7 C5AR2 MTNR1A PTGFR CCR1 S1PR3 NPSR1 ADGRE1 CD55 CXCL6 P2RY14 CXCR4 CALCRL DRD2 HRH1 UCN3
"Hedgehog ligand biogenesis"	0.00319488817891374	0.0236681222707424	0.565475563443182	2.22055643237959	0	57	PSMB9 RPS27A PSMB8 SEM1 PSMB4 PSME2 PSMB10 PSMA7 PSMC3 PSME1 SCUBE2 PSMB6 PSMD4 PSMA5 UBA52 PSMC5 PSMB1 PSMD13 PSMA2 PSMD9 PSMA3 PSMB5 PSMA4 PSMB3
"Hedgehog 'on' state"	0.00709219858156028	0.0296466469751668	0.379771285139371	1.58809556122444	1	79	PSMB9 RPS27A PSMB8 SEM1 PSMB4 RBX1 PSME2 PSMB10 PSMA7 PSMC3 PSME1 PSMB6 PSMD4 PSMA5 UBA52 PSMC5 PSMB1 PSMD13 PSMA2 PSMD9 PSMA3 PSMB5 PSMA4 PSMB3 GLI2 EVC2 SMO PSMD14
"Hedgehog 'off' state"	0.00384615384615385	0.0236681222707424	0.353704140368414	1.52858274985008	0	94	PSMB9 RPS27A PSMB8 SEM1 PSMB4 RBX1 PSME2 PSMB10 PSMA7 PSMC3 PSME1 PSMB6 ADCY5 PSMD4 PRKAR1B PSMA5 UBA52 PSMC5 PSMB1 PSMD13 PSMA2 PSMD9 PSMA3 PSMB5 PSMA4 PSMB3 GLI2 SMO IFT52 PSMD14 FUZ
"Signaling by NOTCH4"	0.0072202166064982	0.0296466469751668	0.391265746162393	1.63741333583126	1	80	PSMB9 RPS27A PSMB8 SEM1 PSMB4 RBX1 PSME2 PSMB10 PSMA7 PSMC3 PSME1 PSMB6 PSMD4 PSMA5 UBA52 PSMC5 PSMB1 PSMD13 PSMA2 TACC3 PSMD9 PSMA3 KAT2A APH1A PSMB5 PSMA4
"ESR-mediated signaling"	0.03125	0.0962357954545454	-0.384353311192411	-1.4013026853202	22	91	TFF1 FOSB GATA3 ERBB4 TLE3 NRIP1 NCOA1 TGFA MED1 CXCL12 CHD1 EP300 FOS CREBBP TNRC6B ZNF217 FOXA1 KAT2B NCOA2 MAPK3 AGO2 HSP90AA1 FKBP5 CTSD POLR2B NCOA3 MAPK1 STAG1 JUND ESR2 CCND1 STAG2 RUNX1 AGO1
"Signaling by ERBB4"	0.0428994082840237	0.122376206789162	-0.457155202643151	-1.47907989252432	28	41	EREG HBEGF ERBB4 CXCL12 TAB2 SOS1 NRG1 NCOR1 PIK3CA NRG4 NRG2 NCSTN SHC1 PSEN1 ITCH WWP1 KRAS ADAM17
"Signaling by EGFR"	0.00595238095238095	0.0264441842310695	-0.512858392062704	-1.69042669396735	3	48	EREG SH3GL3 HBEGF TGFA AREG STAM EPGN PTPN12 GAB1 SH3KBP1 SOS1 PTPRK PIK3CA ADAM12 CBL SHC1 PTPN11 PAG1 PXN KRAS ADAM17 ADAM10 STAM2
"Signaling by PDGF"	0.00146627565982405	0.0236681222707424	-0.54964191852221	-1.82413049299651	0	49	SPP1 COL6A3 THBS1 COL4A1 COL6A2 COL4A2 PLG COL6A6 PDGFRA PLAT PTPN12 THBS4 THBS2 SOS1
